{
  "run_id": "federated-ci-20260326T063147Z",
  "started_at_utc": "2026-03-26T06:31:48.011016+00:00",
  "checks": [
    {
      "name": "contract-conformance",
      "domain": "contract",
      "exit_code": 0,
      "verdict": "pass",
      "stdout_log": "/Volumes/T7 Touch/mini/rather-not-work-on/platform-planningops/planningops/artifacts/ci/federated-ci-20260326T063147Z-contract-conformance.stdout.log",
      "stderr_log": "/Volumes/T7 Touch/mini/rather-not-work-on/platform-planningops/planningops/artifacts/ci/federated-ci-20260326T063147Z-contract-conformance.stderr.log"
    },
    {
      "name": "provider-profile",
      "domain": "infra",
      "exit_code": 0,
      "verdict": "pass",
      "stdout_log": "/Volumes/T7 Touch/mini/rather-not-work-on/platform-planningops/planningops/artifacts/ci/federated-ci-20260326T063147Z-provider-profile.stdout.log",
      "stderr_log": "/Volumes/T7 Touch/mini/rather-not-work-on/platform-planningops/planningops/artifacts/ci/federated-ci-20260326T063147Z-provider-profile.stderr.log"
    },
    {
      "name": "provider-gateway-ready",
      "domain": "infra",
      "exit_code": 0,
      "verdict": "pass",
      "stdout_log": "/Volumes/T7 Touch/mini/rather-not-work-on/platform-planningops/planningops/artifacts/ci/federated-ci-20260326T063147Z-provider-gateway-ready.stdout.log",
      "stderr_log": "/Volumes/T7 Touch/mini/rather-not-work-on/platform-planningops/planningops/artifacts/ci/federated-ci-20260326T063147Z-provider-gateway-ready.stderr.log"
    },
    {
      "name": "o11y-replay",
      "domain": "infra",
      "exit_code": 0,
      "verdict": "pass",
      "stdout_log": "/Volumes/T7 Touch/mini/rather-not-work-on/platform-planningops/planningops/artifacts/ci/federated-ci-20260326T063147Z-o11y-replay.stdout.log",
      "stderr_log": "/Volumes/T7 Touch/mini/rather-not-work-on/platform-planningops/planningops/artifacts/ci/federated-ci-20260326T063147Z-o11y-replay.stderr.log"
    },
    {
      "name": "runtime-handoff",
      "domain": "runtime",
      "exit_code": 0,
      "verdict": "pass",
      "stdout_log": "/Volumes/T7 Touch/mini/rather-not-work-on/platform-planningops/planningops/artifacts/ci/federated-ci-20260326T063147Z-runtime-handoff.stdout.log",
      "stderr_log": "/Volumes/T7 Touch/mini/rather-not-work-on/platform-planningops/planningops/artifacts/ci/federated-ci-20260326T063147Z-runtime-handoff.stderr.log"
    },
    {
      "name": "runtime-operations-ready",
      "domain": "runtime",
      "exit_code": 0,
      "verdict": "pass",
      "stdout_log": "/Volumes/T7 Touch/mini/rather-not-work-on/platform-planningops/planningops/artifacts/ci/federated-ci-20260326T063147Z-runtime-operations-ready.stdout.log",
      "stderr_log": "/Volumes/T7 Touch/mini/rather-not-work-on/platform-planningops/planningops/artifacts/ci/federated-ci-20260326T063147Z-runtime-operations-ready.stderr.log"
    },
    {
      "name": "monday-harness-projection",
      "domain": "runtime",
      "exit_code": 0,
      "verdict": "pass",
      "stdout_log": "/Volumes/T7 Touch/mini/rather-not-work-on/platform-planningops/planningops/artifacts/ci/federated-ci-20260326T063147Z-monday-harness-projection.stdout.log",
      "stderr_log": "/Volumes/T7 Touch/mini/rather-not-work-on/platform-planningops/planningops/artifacts/ci/federated-ci-20260326T063147Z-monday-harness-projection.stderr.log"
    },
    {
      "name": "loop-guardrails",
      "domain": "policy",
      "exit_code": 0,
      "verdict": "pass",
      "stdout_log": "/Volumes/T7 Touch/mini/rather-not-work-on/platform-planningops/planningops/artifacts/ci/federated-ci-20260326T063147Z-loop-guardrails.stdout.log",
      "stderr_log": "/Volumes/T7 Touch/mini/rather-not-work-on/platform-planningops/planningops/artifacts/ci/federated-ci-20260326T063147Z-loop-guardrails.stderr.log"
    },
    {
      "name": "loop-guardrails-outer-status-resolve",
      "domain": "policy",
      "exit_code": 0,
      "verdict": "pass",
      "stdout_log": "/Volumes/T7 Touch/mini/rather-not-work-on/platform-planningops/planningops/artifacts/ci/federated-ci-20260326T063147Z-loop-guardrails-outer-status-resolve.stdout.log",
      "stderr_log": "/Volumes/T7 Touch/mini/rather-not-work-on/platform-planningops/planningops/artifacts/ci/federated-ci-20260326T063147Z-loop-guardrails-outer-status-resolve.stderr.log"
    },
    {
      "name": "loop-guardrails-outer-status-bundle-validation",
      "domain": "policy",
      "exit_code": 0,
      "verdict": "pass",
      "stdout_log": "/Volumes/T7 Touch/mini/rather-not-work-on/platform-planningops/planningops/artifacts/ci/federated-ci-20260326T063147Z-loop-guardrails-outer-status-bundle-validation.stdout.log",
      "stderr_log": "/Volumes/T7 Touch/mini/rather-not-work-on/platform-planningops/planningops/artifacts/ci/federated-ci-20260326T063147Z-loop-guardrails-outer-status-bundle-validation.stderr.log"
    }
  ],
  "required_checks": [
    "contract-conformance",
    "provider-gateway-ready",
    "runtime-handoff",
    "runtime-operations-ready",
    "monday-harness-projection",
    "o11y-replay",
    "provider-profile",
    "loop-guardrails"
  ],
  "generated_at_utc": "2026-03-26T06:35:31.739580+00:00",
  "finished_at_utc": "2026-03-26T06:35:31.739704+00:00",
  "overall_status": "complete",
  "check_count": 10,
  "missing_required_checks": [],
  "failure_classification": {
    "count": 0,
    "domains": [],
    "deterministic_rule": "contract-conformance->contract, provider-profile/provider-gateway-ready/o11y-replay->infra, runtime-handoff/runtime-operations-ready->runtime, federated-conformance->federation, loop-guardrails->policy"
  },
  "verdict": "pass",
  "shell_exit_code": 0
}