{
  "run_id": "federated-ci-runtime-gates-20260319-rerun23",
  "started_at_utc": "2026-03-19T12:19:35.399426+00:00",
  "checks": [
    {
      "name": "contract-conformance",
      "domain": "contract",
      "exit_code": 0,
      "verdict": "pass",
      "stdout_log": "/Volumes/T7 Touch/mini/rather-not-work-on/platform-planningops/planningops/artifacts/ci/federated-ci-runtime-gates-20260319-rerun23-contract-conformance.stdout.log",
      "stderr_log": "/Volumes/T7 Touch/mini/rather-not-work-on/platform-planningops/planningops/artifacts/ci/federated-ci-runtime-gates-20260319-rerun23-contract-conformance.stderr.log"
    },
    {
      "name": "provider-profile",
      "domain": "infra",
      "exit_code": 0,
      "verdict": "pass",
      "stdout_log": "/Volumes/T7 Touch/mini/rather-not-work-on/platform-planningops/planningops/artifacts/ci/federated-ci-runtime-gates-20260319-rerun23-provider-profile.stdout.log",
      "stderr_log": "/Volumes/T7 Touch/mini/rather-not-work-on/platform-planningops/planningops/artifacts/ci/federated-ci-runtime-gates-20260319-rerun23-provider-profile.stderr.log"
    },
    {
      "name": "provider-gateway-ready",
      "domain": "infra",
      "exit_code": 0,
      "verdict": "pass",
      "stdout_log": "/Volumes/T7 Touch/mini/rather-not-work-on/platform-planningops/planningops/artifacts/ci/federated-ci-runtime-gates-20260319-rerun23-provider-gateway-ready.stdout.log",
      "stderr_log": "/Volumes/T7 Touch/mini/rather-not-work-on/platform-planningops/planningops/artifacts/ci/federated-ci-runtime-gates-20260319-rerun23-provider-gateway-ready.stderr.log"
    },
    {
      "name": "o11y-replay",
      "domain": "infra",
      "exit_code": 0,
      "verdict": "pass",
      "stdout_log": "/Volumes/T7 Touch/mini/rather-not-work-on/platform-planningops/planningops/artifacts/ci/federated-ci-runtime-gates-20260319-rerun23-o11y-replay.stdout.log",
      "stderr_log": "/Volumes/T7 Touch/mini/rather-not-work-on/platform-planningops/planningops/artifacts/ci/federated-ci-runtime-gates-20260319-rerun23-o11y-replay.stderr.log"
    },
    {
      "name": "runtime-handoff",
      "domain": "runtime",
      "exit_code": 0,
      "verdict": "pass",
      "stdout_log": "/Volumes/T7 Touch/mini/rather-not-work-on/platform-planningops/planningops/artifacts/ci/federated-ci-runtime-gates-20260319-rerun23-runtime-handoff.stdout.log",
      "stderr_log": "/Volumes/T7 Touch/mini/rather-not-work-on/platform-planningops/planningops/artifacts/ci/federated-ci-runtime-gates-20260319-rerun23-runtime-handoff.stderr.log"
    },
    {
      "name": "runtime-operations-ready",
      "domain": "runtime",
      "exit_code": 0,
      "verdict": "pass",
      "stdout_log": "/Volumes/T7 Touch/mini/rather-not-work-on/platform-planningops/planningops/artifacts/ci/federated-ci-runtime-gates-20260319-rerun23-runtime-operations-ready.stdout.log",
      "stderr_log": "/Volumes/T7 Touch/mini/rather-not-work-on/platform-planningops/planningops/artifacts/ci/federated-ci-runtime-gates-20260319-rerun23-runtime-operations-ready.stderr.log"
    },
    {
      "name": "loop-guardrails",
      "domain": "policy",
      "exit_code": 0,
      "verdict": "pass",
      "stdout_log": "/Volumes/T7 Touch/mini/rather-not-work-on/platform-planningops/planningops/artifacts/ci/federated-ci-runtime-gates-20260319-rerun23-loop-guardrails.stdout.log",
      "stderr_log": "/Volumes/T7 Touch/mini/rather-not-work-on/platform-planningops/planningops/artifacts/ci/federated-ci-runtime-gates-20260319-rerun23-loop-guardrails.stderr.log"
    }
  ],
  "required_checks": [
    "contract-conformance",
    "provider-gateway-ready",
    "runtime-handoff",
    "runtime-operations-ready",
    "o11y-replay",
    "provider-profile",
    "loop-guardrails"
  ],
  "generated_at_utc": "2026-03-19T12:21:00.694392+00:00",
  "finished_at_utc": "2026-03-19T12:21:00.694488+00:00",
  "overall_status": "complete",
  "check_count": 7,
  "missing_required_checks": [],
  "failure_classification": {
    "count": 0,
    "domains": [],
    "deterministic_rule": "contract-conformance->contract, provider-profile/provider-gateway-ready/o11y-replay->infra, runtime-handoff/runtime-operations-ready->runtime, federated-conformance->federation, loop-guardrails->policy"
  },
  "verdict": "pass",
  "shell_exit_code": 0
}